text,airline_sentiment
told refund realli makeup inconveni caus miss meet,negative
pleas explain need pay bag fee twice equal delay flight result bag recheck overnight,negative
watch entir uncvsduk game tarmac cancel flight flight crew time right flight,negative
reflight book problem would made reach time meet also wanna take chanc book userment instead,negative
vacat day relev ritz pr night lose day idiot sleep newark ramada priceless,negative
time spent night tri sleep toddler bed airport ramada without luggag kidnap furiou,negative
call check futur flight first agent hung sent pet travel line hell,negative
fyi siteapp still show plenti unavail flight error almost hr sellout fli userment,negative
sure say long tweet obsolet fleet promis free,negative
follow messag thank much help,positive
pleas consid let flyer overhead bin item boarddeplan first first class make sens,negative
never fli unitedairlin ever check bag angrycustom unitedairlinessuck,negative
thank jt,positive
thank la someth special,positive
flight turn around mechan reason never fli unit check plane properli,negative
customari upgrad flight attend uniform vs passeng one flt iah,negative
userment realli address somewher websit find complet irrit unabl take flight,negative
ua1740 hr mechan delay get voucher tweet book next trip ua,negative
spend minut beat ladi bag fee random stranger come pay fee randomactsofcorporategre,negative
hii still wait refund ridiculousor u approv ticket u give refundpleas advis wht go,negative
thank got rebook alreadi lost first class seat life,negative
book flight yesterday appear account confirm email sinc hour disappear err segment,negative
board cannot agent phone take care travel link reserv,negative
ewr ppl told call sinc monday still layov loc ref tho help appreci,negative
ruth help rerout us punta cana dull connect fail rep help,negative
thank,positive
book time call told confirm link even make chang rez,negative
board flight cancel flight pilot miss meet atlanta someon slept,negative
respons week sinc complaint submit day sinc said would look,negative
thx come hell high water,negative
worri cold weather snow would delay us morn pilot stillwait,negative
rush degre weather get airport time bad pilot stillwait,negative
thank quick repli fill form idnumber8569822 hopetogetanswersoon,positive
hand slip call call tri get sent still layov airporthav ref tho,negative
fine take,positive
recap bounc flight lie hung suppos thinkdo,negative
thank second flight alreadi got bump love,positive
said would need get supervisor wait supervisor hung,negative
call ladi oversea call center said saw note explain situat,negative
could access seat map said would note upgrad itinerari call back late flightr,negative
spoke someon feedback line last night said would get prefer choic seat today,negative
good call tomorrow thank,positive
lose luggag userment lose reserv hour travel day want get userment,negative
oh flight fine lost luggag much look like least half day late flight confer santa monica,negative
flight without work screen friend possibl move anoth place unitedfailsworsttripofmylif,negative
flight wifi even though promis ground crew anotherdisappoint,negative
agre hour late flight arriv unaccept hope pray bag,negative
unhappi unit servic read ralph nader open letter ual ceo leav comment rt url,negative
best seat pay custom get board first badcustomerservic,negative
happen time unit pilot alway exit row america treat custom better employe,negative
ye got gate specif ask seat discourag walk past crew,negative
omg thank,positive
unavail leg regist hour sold option offer traveloc,negative
error messag said could process request last step seat select leg agent unawar,negative
soon go wait time gate empti msp airport flight min still count,negative
horribl wait time get gate show total miss manag valu custom time respect thier sentiment,negative
disappoint servic start gate oper bo rude stop carryon bag,negative
servic suck mexico houston final realiz snack in1st work cheap,negative
guy flight follow threat sue carri bag defend free,negative
pl post video belliger jerk rant sfo go sue make check bag hoot,negative
believ hand worst servic ever experienc make userment look amaz unitedairlin,negative
pleas give special thank aaron tampa offic help liter two hour amaz mission accomplish,positive
cannot tellpurchas websit put us lufthansa flight first leg,negative
funni attend recommend tweet let know subpar custom servic runaround,negative
userment b gate far though,negative
ua5029 ric ua507 ord ua423 den delay nonweath issu way go your bat hotel,negative
would made alreadi book anoth flight cancel flight origin reserv,negative
userment book reward travel august everyth black,negative
win,positive
tri chang flight book hour ago onlin system charg fee per passeng could pleas help,negative
submit complaint need compens long take,negative
horrif flight experi guy made never want fli airplan everi,negative
flight rsw tonight twin year old pilot row stay help get boy bag lifesav,positive
fli unit sorri captain still minut preflight prepar make sat air,negative
ye thx land,positive
get clue miler respons give,negative
tri get email talk busi peopl expect airlin wifi,negative
tri alreadi cancun one deliv,negative
illeg breach contract touch custom feedback,negative
way treat custom lot issu worth headach went thru,negative
ye ewr correct fact beought us share room unexpact,negative
pleas review fix baggag procedur dull happen everi week sister travel airlin,negative
noth els custom servic,negative
oh rebook hour origin arriv time talk compens,negative
cowork conflict hotel issu tri share post facebook page eras,negative
lost parent luggag cancun said would deliv hotel almost,negative
watch connect flight den pull away gate pull gate slapinthefac,negative
userment version row window go ahead check wait,negative
pretti sure got shin split sprint iah watch plane pull away jet way,negative
well incom flight dca take us ewr delay made us miss connect fll ye hotel necessari,negative
pleas stop cancel flightl flight tri get home take two exam tomorrow cancel flightl flight,negative
hung twice staff upset right,negative
hour flight fll ewr wait hour plu bag sign yet give,negative
better airlin continent servic fee flight book problem fee talk human fee fu,negative
despic spoke mani diff peopl everyon tell someth differ claim need bag,negative
come crew travel flight get better seat get stuck check bag crew bag got flight,negative
funni thing happen arriv flight denver gate current schedul depart sydney lol,negative
forgot intl flight lax go intl termin easiest recheck ever woo,positive
cannot claim weather hardwork crew pull seat plane right thing know,negative
missin point weather lie seat broken u claim weather get hotel classi,negative
tri break world record delay flight year,negative
okay thank help,positive
captain said flight san francisco delay due weather ua1416 depart failagain,negative
thank,positive
bet userment turn thirti minut delay origin flight hour delay arriv time,negative
best way reunit one true love shop usa fashion capit newyork unitedvusa url,positive
final destin book unit quanta unit yet contact auckland unawar case id number,negative
worst fli experi ever past three day airlin need get togeth lost custom,negative
ye,negative
customerservic fail long time flyer switch airlin frustrat,negative
okay thank help jt appreci time,positive
screw professor mayb tell everyon userment aviat airport airlin innov startup tech,negative
userment right thing reinstat ticket void unitedfail,negative
neg done wast time amateur custom servic thank least offer,negative
userment week ago awesomebright vibrant habitrail,positive
worri everyon board cushion brought took made,positive
good flight thank,positive
dm hold custom servic long time min get runaround thank,negative
ask simplifi commun thx,negative
ye lhrt2 loung fantast us one could remot similar,positive
omg bag yyzua70435 enough shenanigan alreadi get real old real quick,negative
long take mile repurchas expir show reciev email request,negative
pleas stall flight ord get sna tonight,negative
thank,positive
get gate ua4727 turribl,negative
worst airlin lost luggag delay flight unaccomid,negative
offici favorit airlin creat magic day friendlyski careyon,positive
wonder flight attend name leah us lga den den anchorag,positive
protect flight gate agent kerri la also excel job get destin today thank,positive
staff deck cabin ua768 sfo bo except today pleas tell well done,positive
mean real live person somewher go speak newark post secur,negative
talk standbi tomorrow look good may stay till friday guarante,negative
plz advertis wifi gonna work thank worstflightev,negative
apolog presid employe blame heard repeat time,negative
chang fee exact flight atlhou charg math add,negative
hello oversea bag lost cannot call custom servic help,negative
land anchorag way fairbank url,positive
knew flew userment lol,negative
ua1641 ewrmco feb wifi never connect allow purchas access twice charg need file claim,negative
thnx,positive
admit rather good year still got hook peac,positive
kinda funni worri,positive
feedback concern via site go improv poor airport experi,negative
drop bag newark desk guy rudest custom face person met even two children shock,negative
great look forward respons dm,positive
quit enjoy except stuck runway houston,negative
thank get daughter home userment cancel flightl flight nashvil,positive
thank reupgrad class may min flight appreci,positive
make total sens except flight full emopo got empti seat around overhead half open board,negative
tri get san juan chicago ohar lot problem may get standbi flight,negative
well sorta r tri get aquadilla pr flight goe day book ua cancel flight flight nj,negative
cost chang citi origin flight url cost customerservicefail,negative
userment done thnx,positive
still frustrat gave seat promis travel certif withheld wo explan url,negative
gotta love give class upgrad bc flight delay get anoth flight also delay ensur make connect,negative
sure happen msp yesterday unhappi bag delay sat msp hr b4 deliveri,negative
fli userment way back rare fli let see better,negative
almost like punish live near larg metro area ewr top rank domest delay good,negative
honestli stop tri report thing via websit laugh flight work mile accru sure cosmet,positive
thank weather understand everi singl domest flight delay inbound intl flight crazi,negative
houstonbogota board safeti first seem mechan fix problem faster good energi fli homefamili,positive
tag number luggag taken weigh scale appear sent conveyor belt without tag,negative
report still istanbul moment appar plane haha hat pilot,positive
hey awesom thank repli fill form userment,positive
fli tomorrow mexico us mileag tkt dont show statu help,negative
correct date,negative
phone rep none could see rebook miss flighttold go standbi nonexist late flightr flight hurt,negative
report file airport polic februaryi polic case number requir,negative
cannot dm follow lly144 rebook ua1516 still need seat,negative
supervisor situat stacey took detailsno claim number given us,negative
hour sinc board began still sit gate ua507,negative
tk repli psp employe blame late flight departur potu main reason dvr flt late flight insuffici ground crew handl,negative
took one window also fun get motion sick url,negative
pilot fa ground personnel great job weather blame talk,positive
find text funni consid still sit seat need chang url,negative
houstonbogota engin problem mechan tri fix problem safeti first better chang plane,negative
thank make sens annoy cannot determin better,negative
blame give time get drunk tell feel overpr sub par airlin,negative
idea u want us frustrat cancel flight flight crew overflow toilet get plumber,negative
patient luxuri middl seat next delay flight,negative
patient agent explain book new flight plane arriv,negative
pleas help trace luggag put without name tag februari albuquerqu airport,negative
patient let string tweet go show peopl bad busi,negative
think guy half full flight held overbook flight fill one cancel flightl mine,negative
thank fill form one read respond,negative
patient refus switch flight bc check bag cancel flightl one,negative
sent dm last week suit regard error respons given pleas answer dm tell send suit,negative
tri standbi denver tonight cancel flight father son trip till next year thx tri,positive
wrote got nothingand us simpl thingwil ypu provid compens delay,negative
userment want custom frustrat thank patienc love sentiment one,negative
differ departur arriv updat ua304 pleas,negative
nope realli window one one none sad,negative
vegan meal creativ noodl pea zuke nonvegan yogurt accept vegan better,negative
well thank charg switch two cancel flightl flight anyway pretti nice stillmakingmepoorthough,positive
well john hugh birthday stick w plane hold train automobil gate worker well,positive
son left tablet plane countri call easili email contact,negative
show new program benefici longstand loyal consum userment,negative
hear blah blah blah shoulda use buy userment ticket instead ill drive fli,negative
ye suppos board meet tomorrow finger cross,negative
thank let switch flight bc check bag cancel flight flight forc take anoth hr late flightr,negative
thank love unit flight today,positive
thank check,positive
inform reimburs issu due weather flight keep get cancel flightledthor hate,negative
midland could get bag connect intl flight sydney get em la check em,negative
may last time fli airlin,negative
compani motto care heard sever time employe client past week idonotcar,negative
tell staff lax board group end queue gold member thank noth,negative
miss crew passeng doc problem frozen toilet plane give money back ua3466,negative
fantast job peopl today ua22 dublin jam pack plane crew wonder,positive
min departur one wait press ground staffer threaten want get sf today fail,negative
fli lax sfo system let check site tell userment tell,negative
btw userment userment manag time departur time destin would take away old kid bag,negative
go ahead live premium cabin heaven en rout lhr,positive
feel poor churchmous level dollar enough make grown man cri grown man tear happen,negative
sure plane hour late flight ontim departur ship sail away long time back,negative
ua6002 miss connect ua3530 due delay,negative
come airlin flight last year make check carryon even gate check baggag claim,negative
chang airport actual get flight flight fay cancel flightl twice taxi ride rdureimburs,negative
ye cours treat custom recours,negative
stun bag hartford ord ground crew hour move bag yard,negative
someon assist dm wait hour phone hour twitter,negative
flight overbook offer voucher wait take anoth flight gate agent switch retract voucher offer,negative
thank,positive
thank help understand reduc price seat sold checkin prioriti certif,positive
million miler delay plenti never amateurish wayuserment would embarrass affili,negative
airlin claim low fare guarante honor lower fare found,negative
anoth delay unit flight surpris upset mostli disappoint cancel flight trip dad,negative
still cannot dm lh7631,negative
thank margo houstong bush intercontinent get home earlier,positive
book flight w userment saw price time search least bit frustrat customerservic,negative
thank want see start flight search fare rule itinerari chang,negative
cat flight delay arriv hawaii abl pick tomorrow,negative
mind get next flight,negative
lost bag least nobodi done anyth help absurd,negative
reduct e longer confirm e forget upgrad want legroom unitedfail,negative
offer voucher switch flight voucher offer exist gate agent switch delay flight,negative
usual like fli guy fee use credit seem ridicul notcool exhorbitantfe,negative
thank much miss bag nonexist staff appar remot outpost busi airport citi,negative
friend lost luggag flight,negative
sweet follow back get dm,positive
good next flight littl delay work,positive
board ua1297 refus carri overhead bag space plane load space fail customerexperi,negative
get act right lost custom staff would let us take approv carryon half empti flight,negative
held almost minut promis free movi work neither wifi paid boo,negative
nice partner delay keep increas everi min userment userment url,negative
ua1740 admit clue flight leav denver unfriendlyski,negative
yep long wait phone manag rebook hope pleasent one thank ur help,negative
worst experi ever fli,negative
ua1740 inbound flight dep time get closer push back min hr,negative
flight mke ord get delay gate attend commun,negative
plane sound like dj scratch normal eventu new entertain fee,negative
trust unit futur flight book problemss confirm ticket purchas ticket cancel flightl fact,negative
rebook one late flight,negative
late flight flight today,negative
u miss first leg ur flight pay hundr keep second leg much keep earn mile,negative
iad buf incred loud like third world inner citi metro bu lowstandard url,negative
boe star allianc short final userment amaz winter morn avgeek url,positive
day one flight roundtrip,negative
blown away stellar custserv thank url,positive
overal experi fli friendli,negative
good start would warm plane departur time flight delay due frozen water line,negative
anndd go lose first class seat flight shuffl,negative
nicest gate attend newark airport gate right multipl delay still pleasant everyon,positive
hour mechan delay kill,negative
everi time check bag airlin confid wear cloth day pleas prove wrong,negative
thank unit run water late flight flight grand rapid denver,negative
kn allow bypass receipt refund request form never receiv receipt email charg url,negative
happen realli confus content come screen technolog forward unit,negative
mean like mail address rate surli unit cowork guess benefit great,negative
alreadi sent feedback rep told prioriti speechless system,negative
monopoli userment mean treat frequent flier like crap,negative
yeah bag way per usual actual get use get deliv kind nice sens,negative
take week new mileageplu premier card sent stillwait doesntfeellikestatusyet,negative
wonder peopl hate deal airlin ridicul inflex polici need phone number resolut,negative
le2v9d pnr number flight first leg cancel flightl due bad weather iatanbul make reflight book problem,negative
suggest cannot confirm cert time flight book problem assum may never clear use way,negative
thank explan seem like odd incent structur tho dramat diminish valu cert,positive
userment realli care comfort care profit fine unfriendlyski,negative
userment honest custom new seat design fit row plane row money,negative
miss wed delay would cool,negative
design deter peopl forget thing provid storag space articl say latter unfriendlyski,negative
think miss meet worth flight voucher fli time would make right,negative
userment pile time updat flight tv packag url,negative
hard add meal prefer book ticket forgot imposs even call,negative
amaz realli,positive
learn hold connect text anoth flight late flightr connect left pull gate,negative
ridic cant transfer credit your take cancel flightl atleast let keep credit damn,negative
thank one month ago none weird club one busiest airport us,positive
plane took gate wait lot dia,negative
flight omaha chicago en rout nyc seat partner separ pleas fix re ilc0hp,negative
airport self checkin option employe train bitch send paycheck asap,negative
websit say day count,negative
lack custom servic astound url,negative
bag day late flight like time past coupl month free mile,negative
cours helpless everyon els,negative
flew ord miami back great crew servic leg thank,positive
year old fli tokyo vacat bad knee happen url userment userment,negative
anoth week pass hope would respons,negative
there reason take day respond,negative
ye know question still case fail,negative
exitrow window shade approx window rj145 frequent flyer url,negative
worri custom servic get bad wrap spoke w agent save huge amount time apolog yesterday,positive
excus leav minor spend night sob hour plastic chair ua action terribl unit,negative
perhap could fix url url answerthi,negative
wife share dread experi pretend ua care young girl travel alon unit airlin,negative
jh go process refund wifi ask receipt never receiv email guy whack credit card,negative
userment post link articl verifi initi complaint comment say thing userment,negative
userment break somehow make longer cut circul leg unfriendlyski,negative
peopl statu get buy upgd much less cost ahead premier earn confirm certif,negative
worst agent us ft lauderdal airport passeng stand line get statu alert still make announc,negative
get free upgrad problem reserv mkwlkr,negative
regard flight coupl week ago frustrat polici express,negative
thank reach seat hard enough cushion ok short flight btw ua6465 flight crew great,negative
surpris otherwis flight good feel airlin,negative
told lost guy know,negative
userment land day late flight almost sleep feel sorri woman consol who mother die night,negative
disappointedunit feed small children half hour flight honolulu lo angel appal esp food waspaid,negative
thank supervisor miriam provid great custom servic final,positive
fill airport part long day made longer,negative
today staff msp took custom servic new level father pass away last night help get home today thank,positive
ua6255 delay winnipeg plane frozen fail make connect ua1059 tightconnect denver,negative
delay hour miss connect due mechan issu flight rebook pleas call,negative
userment know updat everi hour tell know bag also equal irrit coltsmissingbag,negative
lightyear ahead secur control newark airport wast preciou min w bad effici frighten,negative
great thank,positive
montego bay go back gate bc late flight aw servic came time,negative
right guy charg air breath next,negative
word sorri sorri plenti airlin travel lot,negative
delay unit gate agent borderlin rude ask flight statu question happen unit,negative
need speak supervisor someon will help use credit asap letsworktogeth,negative
give servic terribl forc use unit certain rout never would,negative
club denver dope,positive
check agent would tag bag stand line hell,negative
never go get gate rate,negative
get ridicul miss connect,negative
could use confirm upgd cert gave bc decid sell anyon biz seat bother give,negative
lock account need access book flight,negative
chanc troubleshoot check in userment minut per person,negative
earth could close unit club atlanta major fail airport size,negative
sorri hear outsourc plan bois best staffcust servic countri bois,positive
lgaord ua get agent name argument baggag polici,negative
ye staff rude unempathet need jacket tablet got u take carryon caus plane fulldo lose em,negative
monday even,negative
ticket counter master smf help,negative
cool thank,positive
baggag shannon never mind u work give back,negative
listen lowest provid inflight wifi get time,negative
funni email userment found left lhr mean time stuck bag nyc,negative
biggest joke companyi never fli day wait bag even know,negative
updat flight delay super frustrat,negative
go airlin loung w star allianc club card bcn told star allianc accept,negative
u repli custom refund form unitedairlin,negative
shoddi custom servic use whatsoev unitedairlin,negative
repli email,negative
day sinc appli compens correspond,negative
submit custom care form jan still respons littl longer busi day,negative
userment clearli unit live stone age peopl need comput make site better tablet phone,negative
userment deal via email anyth crappi web form made mobil devic,negative
userment userment next thing know unit believ dot take court unit anticonsum,negative
userment userment read last hashtag go f unit make sens sinc f us cancel flightl ticket reserv,negative
delay connect custom servic today abl pay final respect dear famili member thank,positive
userment sorri unit abl keep word cuz total inadequ still say custom fault,negative
know bag knew hour ago kill worst servic ever,negative
stop pretend care welfar daughter unit airlin opportun help n fail unit airlin,negative
receiv one previous check odd said complaint associ email,negative
ok pretti sure wait see happen,negative
check trace inform got number wrong phone number turquois duffl bag becom black laptop bag,negative
treat servic member like crap never fli unitedairlin userment,negative
point upc code check baggag cannot tell luggag vacat day tri swimsuit,negative
nonstop flight competit price jetblu virgin vs ident time,negative
come baggag updat,negative
thank respons bag came long wait prioriti tag honor disappoint,negative
userment hit keep come url unitedfail unitedwithivi,negative
hi jh ye pleas sinc lost almost whole day way could help chang return one day late flightr,negative
hr search flt find site cannot book offer bc seg realli avail lie falseadvertis,negative
next flight think spend anymor money guy ever bad,negative
bag yet palm spring airport lax come beat bag,negative
could chang tire delay ua1127 flight arriv instead wait board,negative
gener form ton field ask info alreadi expect premier platinum anoth servicefail,negative
wtf usernam andor email addr signin still unavail tri login sinc sunday,negative
want bag vital equip royal screw cranki want updat,negative
guy big heart keep good work,positive
flight sime rudest flight attend run drink card flashlight drop noapolog,negative
disappoint userment partner commun extrem late flight flight realli around horribl,negative
unless guy im good,negative
mile go restructur help silver statu brotha thought win guy today lol,negative
