text,airline_sentiment
plu ad commerci experi tacki,positive
realli aggress blast obnoxi entertain guest face littl recours,negative
realli big bad thing,negative
serious would pay flight seat play realli bad thing fli va,negative
ye nearli everi time fli vx go away,positive
well,positive
amaz arriv hour earli good,positive
pretti graphic much better minim iconographi,positive
great deal alreadi think trip userment even gone trip yet p,positive
userment fli fabul seduct sky u take stress away travel url,positive
thank,positive
sfopdx schedul still mia,negative
excit first cross countri flight lax mco heard noth great thing virgin america,positive
flew nyc sfo last week could fulli sit seat due two larg gentleman either side help,negative
fli userment,positive
know would amazingli awesom bosfll pleas want fli,positive
first fare may three time carrier seat avail select,negative
love graphic url,positive
love hipster innov feel good brand,positive
guy mess seat reserv seat friend guy gave seat away want free internet,negative
statu match program appli three week call email respons,negative
happen ur vegan food option least say ur site know abl eat anyth next hr fail,negative
amaz cannot get cold air vent vx358 noair worstflightev roast sfotobo,negative
hi bked cool birthday trip cannot add elev caus enter middl name flight book problem,negative
help left expens headphon flight iad lax today seat one answer number lax,negative
await return phone call would prefer use onlin selfservic option,negative
great news america could start flight hawaii end year url via userment,positive
moodlight way fli best experi ever cool calm moodlitmonday,positive
userment done done best airlin around hand,positive
chat support work site url,negative
view downtown lo angel hollywood sign beyond rain mountain url,positive
hey first time flyer next week excit hard time get flight ad elev account help,negative
elevategold good reason rock,positive
wow blew mind,positive
userment userment juli andrew way though userment impress userment,positive
hi excit deal tri book sinc last week page never load thx,negative
know need spotifi stat guiltypleasur,positive
userment userment ladi gaga amaz,positive
call week ago ad flight elev still shown help,negative
userment userment love three realli cannot beat classic,positive
heyi guyi tri get hour someon call pleas,negative
hi virgin hold minut earlier flight la nyc tonight earlier,negative
congrat win userment award best deal airlin us url,positive
everyth fine lost bag,negative
airlin awesom lax loft need step game dirti tabl floor url,negative
worri great ride new plane great crew airlin like,positive
awesom flew yall sat morn way correct bill,positive
go custom servic anyway speak human asap thank,negative
cannot supp biz travel like userment custom servic like userment neverflyvirginforbusi,negative
appli member inflight crew team im interest flightattend dreampath g,positive
best whenev begrudgingli use airlin delay late flight,negative
interest fli cancel flight next four flight plannedneverflyvirginforbusi,negative
disappoint experi share everi busi travel meet neverflyvirgin,negative
troubl ad flight wife book elev account help url,negative
site back,negative
like tv interest video disappoint cancel flightl flight flight went jfk saturday,negative
land lax hour late flight bag check busi travel friendli nomorevirgin,negative
websit btw new websit great user experi time anoth redesign,negative
cannot check add bag websit work tri desktop mobil url,negative
let scan passeng leav plane told someon remov bag class bin uncomfort,negative
phone number cannot find call flight reserv,negative
anyon anyth today websit useless one answer phone,negative
must travel miss flight late flight check bag miss morn appoint lost busi sfo2lax,negative
direct flight unexpect layov vega fuel yet peep next bought vega flight sneaki,negative
late flight bag check lost busi miss flight apt three peopl flight exp,negative
amaz custom servic raeann sf best customerservic virginamerica fli,positive
call servic line hung awesom sarcasm,negative
site trip tri check get plain text version reluct enter card info,negative
getaway deal may oneway lot cool citi url cheapflight farecompar,positive
getaway deal may oneway lot cool citi url cheapflight farecompar,positive
great week,positive
come back phl alreadi need take us horribl cold pleasecomeback url,positive
concern fli plane need delay due tech stop,negative
best airlin flown oneasi chang reservationhelp repres comfort fli experi,positive
anoth rep kick butt naelah repres team beauti thank,positive
beauti frontend design right cool still book ticket bc backend secur,positive
love team run gate e9 la tonight wait delay flight kept thing entertain,positive
use anoth browser brand reput built tech respons crossbrows compat websit,negative
flight flight book problem site total folk problem,negative
like custom servic min delay connect passeng seem long va370,negative
thank outstand nycjfk crew move mountain get home san francisco tonight,positive
absolut best team custom servic ever everi time fli delight thank,positive
need chang flight that schedul hour min wait time phone im call intern help,negative
complet awesom experi last month bosla nonstop thank awesom flight depart time vabeatsjblu,positive
fail custom check process link tsa precheck,negative
userment us terribl airlin gave us hotel hotlin number said sorri,negative
userment assist yesterday u cancel flightl flight give us hotel hotlin shame,negative
anoth delay flight likingyoulessandless,negative
need regist servic dog first class ticket sfo dull phone queue hour longer pl advis,negative
rock make watch oscar flight redcarpet oscar oscars2015,positive
alway xoxo,positive
cannot book seat flight buy even check creat much anxieti frustrat,negative
would think pay extra buck rt luggag might afford hire extra hand userment lame,negative
best custom servic rep world irmafromdalla take cake,positive
pleas provid statu flight cant imagin time web indic dude weather andor dalla,negative
amaz staff super help ran userment princesshalf spoil comfort,positive
paid premium fli across countri cancel flight flight offer check fee upgrad love sad face,negative
question possibl book seat infant give option want seat,negative
alway togeth welcom rt userment userment welcom,positive
flight home dc sunset globe ing backtowint back work refresh url,positive
userment understand need dm give answer damag luggag polici,negative
userment mean polici destroy luggag,negative
thank check ticket purchas custom happi,positive
problem flight book problem web site keep give error contact phone phone minut wait,negative
reschedul cancel flightl flight onlin chang button grey,negative
rang wait minut book ticket vendor fix site,negative
got flight told today check email tomorrow unaccept,negative
flight lga cancel flight stuck dalla call reschedul told could get flight today,negative
pair includ red wine white offer emoneg redwineisbett,negative
websit,negative
site seem littl wonk right may want look tri two browser css url,negative
disappoint agent design silver statu check line userment close assist paseng,negative
normal receiv repli central baggag baggageissu smh,negative
logan airport wait checkin flight checkin desk open,negative
congrat got busi ewr sfolax fuck userment fl1289 sfoewr clincher,negative
appli week ago heard back fli week disappoint,negative
thank follow,positive
mani apolog r wors airlin even respond cudtom,negative
shame va make peopl spend money strand citi airlin land jfk reimburs,negative
bad say take day via confirm email inquir week claim week,negative
flight bo la tomorrow cancel flightl notif wait time hour rebook anoth airlin,negative
rt userment met match got statu anoth airlin upgrad restr emoneg url url,positive
way fli elev gold,positive
lot apolog thrown custom seeveri sad thank noth worst airlin ever,negative
flight stuff wrong noth worst flight ever,negative
match americanairlin statu cool,positive
tri book flight guy websit let lose busi,negative
suck,negative
thank,positive
dm would issu persist,negative
never rec would cancel flightlat notic left w option fli ps drive la red eye mon w kid,negative
tri book flight site,negative
flight fli boston tomorrow need home cancel flightl flight anyth,negative
stink flight cancel flight psp jfk notif abil rebook disappoint expect better,negative
love guy song danc high school danc revu,positive
websit tri check,negative
done thank quick respons appar faster sit hold,positive
cool pictur anoth virginamerica plane wing site url,positive
keep great work,positive
good peopl userment field amaz pressur texa beatstheoth crisi pleas fli ny,positive
thank great flight la boston pilot great job land snow go back la serious,positive
thank much awesom support guy rock,positive
seat row reclin mention websit soreback,negative
flight delay hour la due mechan problem handl like pro could toss us free drink,negative
cancel flight flight today precipit scare,negative
twitter team guy kill reschedul asap thank,positive
guy charg reschedul flight cancel flight refus refund deal,negative
access websit safari iphon seem work mac ipad need iphon add passbook,negative
mobil site broken show headerelevateusernumofpointsavail number point let checkin,negative
realli look forward flight let know reschedul diehardvirgin,negative
cancel flight flight vx413 one sec delay airport next cancel flightledgonna email call reschedul,negative
problem link email checkin thank,negative
chang anoth airlin get dc today userment abl land dc cost ugh,negative
look forward first flight today cancel flightl along subsequ one,negative
put great deal pdx la la pdx show love url,positive
wish afford fli next friday go back home love everyth airlin,positive
gonna deal dalla dc deal dc dalla sad,negative
hold time call center bit much,negative
like url,positive
site help,negative
best flight attend ever url,positive
awesom rt userment watch nomin film feet meetthefleet oscar url,positive
thank much,positive
tri reset password email never arriv help,negative
airlin base silicon valley disrupt fcmostinnov incub userment url,positive
nice done,positive
look forward watch oscar flight home tomorrow might even get someth bubbl drink,positive
reason delay departur vx jfk afternoon,negative
today flight palm spring ca jfk ny cancel flightl,negative
hahaha guy amaz love,positive
sound like fun,positive
css site right pleas fix site unus,negative
flight vega boston today check onlin bag count regist fix somehow,negative
classiq luv virgin america greetingz,positive
hi tri checkin websit work tri differ browser problem continu,negative
thank great custom servic today help get travel sort,positive
thank guy sweet rout rocki airplanemodewason,positive
love music blast gate boston wait flight sanfrancisco could get ice coffe,positive
passeng flt assault flown trust ban crew file report userment,negative
current bug websit show departur select destin citi url,negative
luggag sever dentedmiss wheel come baggag claim san luggag agent miranda think help,negative
thank easi itinerari shift impend weather quick painless free,positive
thank good time back vodkaton entir,positive
great job ad littl luxuriesaesthet improv air travel experi thank keep,positive
request window seat confirm window got stuck middl seat good way treat silver,negative
wtf paid direct flight purpos stop fuel exhaust frequent flier noth inconveni,negative
someth wrong websit safari iphon,negative
thank gate check baggag full flight dfwlax give earli board sweet,positive
alreadi check page expir x,negative
boo refund seat upgrad fee want buy first place,negative
see,positive
inflight team make experi amaz,positive
cutest salt pepper shaker ever think guy cannot get better url,positive
move seat notic better seat cabin select behind row disappoint,negative
fav airlin,positive
hot femal pilot sweet dca sfo,positive
alreadi contact central baggag sent dm userment charg dress lost suitcas help,negative
thank,positive
anyth go websit get lot error past minut,negative
userment check flight sfo lax told atlant fli club gold get benefit,negative
husband order three drink via screen never came awesom,negative
soo guy go leav seatbelt light flight bare call turbul,negative
funni stori websit broken miss javascript stylesheet checkin process dislik,negative
would love virgin like userment,positive
tri check ct flight tmm desktop websit work sort cach bug so,negative
guy know checkin link email broken url,negative
love cannot wait monday return flight mostli watch inflight safeti video sorrynotsorri,positive
lost luggag day ago flight vx lax iad call everi day responsepleas give back stuff,negative
flight book problem section websit seem broken chrome might wanna look,negative
hi want see new rout plan year newark love fli guy hope,positive
mean probabl inappropri board,positive
happi spend day togeth let,positive
userment understand help thx comp,positive
thank absolut,positive
look like broken link asset url,negative
manag itinerari section websit seem broken url,negative
cannot check site look like everi time load url,negative
carrier less half price round trip fare stun url,negative
wtf happen pdx late flight march one way sfo,negative
free drink flight back free promo,positive
userment thank,positive
luggag gone file paperwork promis callemail still resolut respons central luggag,negative
thank,positive
thank take care userment flight rockstar travel,positive
thank love soft view travel san sfo url,positive
request mileag challeng statu sever week ago onlin heard back get help,negative
tri book ticket nyc face super fun broken style worri keep tri,negative
appli statu match feb got confirm email day still news though guy drop ball late flightli,negative
ador look forward flight austin two week,positive
glad mention took first virgin flight year back transform experi,positive
tri checkin look like site,negative
spend birthday night daldca get home,negative
sent coupl messag email provid avail tri next year cheer,negative
first time fli virgin went sanfrancisco thank smooth ride easili new fav airlin,positive
serious though direct flight sfofll may,negative
fine alreadi done purchas tri go way go back,negative
realli experi hope ws forc check small carri w noth empti cabin space board,negative
luggag slow lax,negative
spoke repres offer solut loyal custom fli userment well,negative
deepli disappoint birthday promo appli trip book mere day receiv email,negative
happen direct flight sfofll look may see connect help dontdothistom,negative
promot product problem southwest recommend noneoth best url,positive
love guy pl get direct rout la au,positive
cours work userment obsess entir virgin famili,positive
ok first time fli tonight,positive
emboss badg patch superior one current use url,negative
vx399 jfk la dirti plane standard,negative
flight vx399 head la jfk dirtiest va plane ever sad great airlin,negative
got squar away someon pick soon tweet tweet sooner,positive
avi rental continu button work websit book car tri time phone suck,negative
delay to1030,negative
current minut hold cust servic need anyth add lap child reserv,negative
userment cours fun thank happi chines new year,positive
flight book problem last second flight next week sfo san chanc want gift promo code sinc love guy,positive
comen bank joke pleas chang noth constant problem bank,negative
grandma ella would bday greet flight crew stewardess eastern airlin,positive
bought tix atx dalla rout thank ad love yr airlin yr websit best transact site ever,positive
gave credit late flight flight yesterday great servic wow moment unexpect gestur,positive
submit statu match request back still heard fli monday look acceler,negative
safeti video url love first cross countri flight livewelltravel sytycd,positive
look fat look yummi,positive
omg nonstop dalla austin,positive
plane realli pretti thought u know,positive
pull hair tri book flight u site work iphon ipaddo comput help,negative
thank,positive
get help support ticket day incid thank,negative
good home texa moodlight url,positive
cannot even open laptop seat paid premium let,negative
seat cannot even open laptop paid extra seat,negative
thank need way make austin trip dca come,positive
cool never ur plane,positive
great well deserv,positive
fyi infouserment email address say contact password reset email exist email bounc,negative
statu match week gone newsflt next week hope flt count toward requir cust svc help,negative
websit suck donkey dick thought know best,negative
crap channel pay watch uk tv,negative
got set thank,positive
giant virgin america match made heaven,positive
thank good also see friday boom,positive
come iphon app still use make wast paper,negative
back seat entertain system accept credit card apostroph surnam apostrophefail,negative
vx use lga slot instead today ad au make less like,negative
luv ur peopl product thing u charg herbal tea black tea caffein drinker,positive
thank see yall soon excit see expans destin spread wing,positive
sad learn longer fli sfo phl hope return,negative
incred custom servic ever experienc refresh,positive
dream realli open rout dalla austin mean houston might next,positive
omg final,positive
kinda suck earphon jack work flight may want look futur passeng,negative
poor experi first comput problem seat malfunct stuck miss meet san diego,negative
thankyou dalau rout make day,positive
awesom deal dalau way url,positive
love take userment backyard consum win biz compet,positive
fli love austin excel news,positive
congrat vx new rout,positive
tri offer charg addit new ticket strand thur time last time,negative
never bad experi one took cake extort carri item well,negative
spend hour worri item carryon would brokenstolen sinc could carri plane lock bag,negative
group e told room bin got plane room least bag row,negative
thank make flight lax jfk nightmar forc check carri bag gate,negative
lot flight book site work phone wait minut,negative
flight artisan chees wine pair,positive
classi,positive
sure lot jfklhr flight go lot faster strong tailwind,positive
tminu minut elev silver upgrad window open freeneversuck,positive
take year fli home dalla get shit togeth,negative
userment would rough trip luckili virginamerica flight weather,positive
anoth perfect flight come plane sun visor stay carrier make rais,positive
nice rt userment man steel might faster wifi say sciencebehindtheexperi url,positive
love danc littl richard cool bean,positive
use passbook still love though emopo use email futur,positive
thank free birthday point yall right,positive
man steel fli citi though frequenc,negative
thank much share ad site url,positive
dad segway best part whole infograph,positive
plan short haul airlin europ would defiantli fli guy,positive
wifi better seat,positive
start flight scold use overhead bin offer person seat next,negative
userment great return call day could ask myvxexperi,positive
airlin cancel flight flight bo help custom get home virgin say good luck,negative
group virgin other bo weather expos actual cu serv model never flight book problem virgin,negative
one travel affect boston storm shock virg complet apathi toward custom,negative
umm reason someon differ contact contact get definit answer,negative
tri make chang advanc hour onlin earlier want chang fee,negative
loyal drive nyc pa fli virgin sinc cut philli flight,positive
guy perfect alway wervirgin,positive
thank yall best custom servic left industri,positive
realli wish would fli fargo userment fare amaz,positive
mood light reclin seat kickin,negative
flight schedul departur still say time plane gate updat long delay,negative
group got cancel flightlat fee waiv cannot ticket book rep help either,negative
got newark home la folk ewr incred letsgohom,positive
fli lax sfo look awesom movi lineup actual wish long haul,positive
thank,positive
thank take care mr happi custom,positive
still refund word via dm pleas resolv issu cancel flightl flight useless assist trip,negative
delay due lack crew delay there long line deic still need improv servic unit,negative
thank fill luck common,positive
eriord express connect huge popular could eriewr hop,negative
think board flight au1066 earli think,negative
gate agent hook altern flight way prevent constant issu would rock,negative
thank,positive
thank ticket,positive
worst nonrefund first class ticket oh select globalfc system auto select economi wupgrad,negative
userment buy tix day flight cannot transfer tix flaw secur logic flaw custom servic,negative
start claim week unrealist realli suppos go long car seat childridicul,negative
follow pleas airlin beautiful,positive
car seat lost userment reimburs new one pair shoe necess child,negative
userment total suck cousin work phl said userment,negative
want let know wonder rosetta gate agent work flight dan ase let know wasappreci,positive
begin feb call unit said would send anoth voucher mail never got anyth tiredofwait,negative
internet great thing email execut compani mayb respond time manner,negative
that weak see ya hey userment,negative
flew back w compani sinc unit didnt earlier flight,negative
tri book award septemb need flight userment show even w mani award seat availab,negative
sure drive total hour get bag would like explain debacl one want talk,negative
see told repeatedli pilot late flight kept get late flightr board defibril issu,negative
prefer secur line anymor tsa precheck pull userment partner flight platinum spoil,negative
newarkliberti airport need indic differ gate termin flyingainteasi,negative
ye pleas newli marri tri updat last name preexist intern flight seem easi,negative
unit refus reissu lost voucher plane take due mechan badcustomerservic,negative
also run instruct shatter comput url,negative
ye agent last minut one agent rude thank ladan nice,negative
iah charlott baggag claim rep latric h customerservic non exist ignor custom inappropri touch custom,negative
thank help got need issu userment guess sit awhil longer,positive
userment would love respond websit saw realli long form busi new seat bad,negative
refund flight voucher anoth flight differ airlin expens today hour drive inconveni,negative
receiv call back day infant car seat suppos go anywher child,negative
well sit ground time wait gate tiredofthi,negative
airport snow remov method keep good work folk cessna becom url,positive
need guy book plane concern travel someon els move forward,negative
measli ecertif appreci loyal custom wait tarmac ua116 unaccept,negative
email addressusernam signon avail,negative
thank abl claim interim expens cost stuff,positive
rude rude,negative
cannot get board pass austrian airlin codeshar flight rebook incl hour layov stuck outsid sec,negative
receiv flight unit truli break guitar unitedbreaksguitar wantmymoneyback,negative
flew telaviv paid third suitcas even make plane besid impolit servic,negative
bag still colo spring disabl search unfamiliar airport look bag good outcom,negative
shame there flex ticket transfer rule even call neurosurgeri icu enough,negative
denver said handl baggag made colo spring gave number call help either,negative
guy need seriou train custom servic mani better option put way guy handl ur mistak,negative
found problem avoid like plagu told cannot find supervisor,negative
zcc82u cancel flight flight advanc need connect flight reschedul link help help gf wait month see,negative
fli,negative
addit first flight delay hour arriv destin hr late flight,negative
flew unit last month experi awesom,positive
travel book thru unit group dept okc ticket agent less will help connect lax,negative
v upset disabl servic told one employe carri medic equip rude,negative
thnx quick repli think assist intl grp put consider inconveni today,negative
wont transfer flight ticket accompani yr old who activ militari mom emerg brain surgeri wow,negative
userment week late flightr still receiv mile mileageplu gift card starbuck card hand,negative
alway hope improv,negative
yet complain guy check luggag throw bag around unfortun coincid hope,negative
okc ticket agent roger mclarrensp less help intl group travel problem cannot find supervisor help,negative
mobil app need construct ground os categori expens get right,negative
anoth fail unit ticket agent okc less help could care less problem american come,negative
also work wc coach good thing bird land ahead schedul use wc stat,positive
sent email custom care tell may break sincer hope help,negative
silli fli delta today unit club staff attend surli unhelp alway seem bother peski folk,negative
phone number cannot find call flight reserv,negative
well cannot fix miss buddi bday neglig attempt make,negative
believ help custom servic could like said want number someon fix,negative
help baggag servic desk said bc tsa screen fll bag made bag ewr,negative
mobil board pass disappear phone stand line board second time week hmm,negative
record rozana newark love help choosekind,positive
thx updat,positive
explain eager flight attend tri ask vision userment guid dog,negative
point ask detail servicedog book flight crew read continu,negative
tri one avail bogota everyon rude houston stuck hour guy,negative
worst2unitedflightsev ua la iad mechan problem took land fix delay wtfodd,negative
despit bag make newark good inform email track updat help,positive
go ua outbound flight last thur delay long delay worst2unitedflightsev,negative
