text,airline_sentiment
flight delay close door tell us would leav hour half bad bad servic,negative
would give us option get plane instead sit hour half knew gate,negative
overflow armrest leg sprawl refund choic grossedout,negative
appreci prompt respons,positive
noth avail male flight crew nicedismiss big guy standbi probabl even pay choic,negative
well told sit plane hour option get,negative
want hang plane day travel get work done turn right back around unaccept,negative
seem like bc team fail scan bag lax recycl bagtag number help usairwaysfail,negative
complet wast day trip work turn sit plane day ridicul,negative
given option get plane sit time longer actual flight,negative
plane move ice move end runway sit lga one runway open,negative
noth avail male flight crew nicedismiss big guy standbi probabl even pay,negative
set lawsuit way sit plane hour half,negative
thk us phl fll overal class improv food phl fll crew super,positive
want sit plane dca lga hour half longer flight,negative
unaccept go day day sit plane mention air,negative
move plane end runway us sit hour half even let us,negative
hi somebodi avail help refund unbeliev phone w us hr day,negative
plu us airway need someth left philli thaw url,negative
order scotch water fa ask want full glass half yr old first time ever ask,negative
yeah mark like mile back also hour late flight thank ton great servic today,negative
got drink fa sat jump seat crossword glass pick land lazi servic first class,negative
paid choic seat choic big man next seat oldseatnocushion worstflight nohelponboard,negative
first class snack basket cater drink preflight drink coathang drink servic min take,negative
told us last night ground stop ohar four hour obama land stop blame someon els,negative
delay due frozentoilet medicalissu mechanicalissu dispatchissu heard letsgo,negative
abl mean privat convers help w luggag fit overhead,negative
worst minut delay boston weather relat flightd go miss connect flight gass plane issu,negative
worst still left everyon miss connect,negative
today flight philadelphia littl disappoint unnecessari delay even snow fl,negative
tri book flight use mile straight day min phone still talk human,negative
gonna miss connect flight delay fli boston,negative
flight wait weight balanc info past minut,negative
thank refund baggag realli appreci,positive
thank take flight board provid updat flight minut late flight,negative
userment go miss us airway alway provid great servic never let,positive
never wors experi life url,negative
userment rebook cancel flight flight crew expir board unaccept start delay,negative
hr strand dca zero apolog worst custom servic faith travel year,negative
respons correct fact pilot fail keep passeng updat,negative
dca pm still due mechan issu lack snack plane absolut wors experi,negative
almost hour late flight due mechan,negative
never fli usairway horribl experi terribl custom servic,negative
sunday day away,positive
unaccept knew pilot would abl complet trip wast time,negative
three plane flight still left ground bad servic sad,negative
told offload captain hour terribl experi,negative
load onto plane hour late flight mind made sit minut,negative
load us flight captain hour could fli one consecut period unaccept,negative
offload plane ridicul,negative
userment excit fli us jb spring break,positive
actual true get seat onlin big hassl polici total dishonest mislead faa,negative
thank least tweet back emopo better,positive
seem unlik without crew board us,negative
incorrect four peopl last flight night bag horriblecustomerservic,negative
exict fli yall soon,positive
fact make custom pay choos seat tri convinc use psycholog trick color,negative
addit review blog agent pleasant experi less,negative
new seat assign servic embarrass airlin custom worldwid shameony usairwayssuck,negative
worst experi ever blog tomorrow experi mayb help make better,negative
freez bu circl,negative
pleas explain plenti time sinc strand,negative
doubt r still held captiv ground dca littl commun front would b nice,negative
cost chang ticket cost purchas new ticket,negative
sit freez bu nobodi plane,negative
alreadi spoke someon sever time matter one sympathet fli us home earli complimentari,negative
want get home,negative
stand alon bought tix base usair confirm flight good confirm chang anyway,negative
u r prof hostag takersw stood bu plane minnow sit plane mvmt announc hour,negative
bet pay custom know check flight delay thank,negative
cannot even use return flight home chang fee charg expens forc purchas new ticket,negative
oh great hour delay get sit plane anoth hour without move flight aw,negative
sorri receiv compani least could fli us home earli extra charg,negative
never fli guy extrem disorgan mani delay,negative
buddi current delay hour count dca way cae golf week compens flydelta,negative
flight delay flight miss help,negative
flight connect,negative
even simpl googl search flight number tell gate difficult sure disappoint,negative
ye sure guy know gate occupi keep us wait,negative
wow mile program ripoffquick ticket fee hope end unemploy,negative
bo dca delay need stop file complaint faa consum affair,negative
sit tarmac wait deplan minut level servic come expect,negative
gladli take loyal custom money caus inconveni noth help fix problem caus,negative
least could make caus ruin peopl memori asham,negative
late flight plane miss flight crew mainten problem gate switch time call custom servic,negative
due expens chang fee either airlin chose could screw us strand help,negative
cannot afford intern chang fee rebook trip want go home turn cannot afford go home,negative
ruin honeymoon caus us miss intern flight strand,negative
fa attend phl pwm tonight fab asset team great night team,positive
thank overflight book problem first class automat downgrad upgrad min board ffstatusdontmatt thenewaa,negative
grandbabi week travel dc birth thank reason fare see saturday,positive
thank userment fare dtw dca much lower userment userment thank,positive
flight phl london sit tarmac wno updat pilot give,negative
alreadi four time,negative
minut hold serious averag wait time minut mayb mayb understaf,negative
submit refund request b4 flight day ago need,negative
know thank evalu emopo chairman,positive
serious share concern four time alreadi avail geezz frustrat flyer,negative
hot food hour flight crazi could eat phl bc origin connect min late flight give phltola,negative
serious flight delay cinci philli due new ground staff miss connect man uk argu hotel wtf,negative
thank continu worst airlin need extra hour sleep hour travel anyway,negative
guess respond compliment sorri cannot thinkuserment even one,negative
usairway disappoint cancel flight flight miss appoint promis refund lie,negative
minut hold wait speak agent come usairway ridicul baggagelost usairway,negative
unabl locat baggag frustrat son cloth need zfv yyz usairway baggagelost,negative
alreadi question still say progress userment day,negative
kid bad custom servic folk flew psp phx flight cont url,negative
thank get reschedul direct flight nola tonight minutesand hope hour earlier get,positive
problem flight gainesvil us airway clt miss connect flight iad get anoth flight,negative
still rep talk day late flightr u r ask checkin flight tmrw refund request deal w,negative
flight wait minut rsw wait weight balanc clearanc come let us leav,negative
userment mark complet scare go lose reserv money go refund,negative
userment complet case still say progress paypal websit reserv,negative
appreci call flight delay record msg tediou goe vote text practic,negative
horribl commun delay flight lga got email second w differ delay time horribl,negative
thank final got bag custom servic rep wonder,positive
min hold time hang manag mike dividend mile dept tough justifi stick us air cc statu,negative
never fail disappoint,negative
platinum flyer bought tkt aa also account link cannot check flight tomorrow,negative
person take ticket rude delay minut overfil fuel plane,negative
flight seattl much fuel water lavoratori nice job guy est behind,negative
flight lead fa bill profession fa seen year fli usair ab card,positive
miss work taken philli flight bo phl mani time re seat,positive
userment total lack cust servic mom fli solo w babi fli w air,negative
pure anarchi flight slc peopl walk noth pack bag arm full stuff getittogeth,negative
userment know hockey stick expens baggag handler throw cart,negative
problem thing work airport thank,positive
tri doesnt help much reserv seem overwhelm issu,negative
take lesson userment wait passeng connect flight shame,negative
ye domest flight thank,positive
thank made safe url,positive
say connect good still anoth reflight book problem last thing need today,negative
tell talk userment delay flight aa tell talk us ihatemerg,negative
holdup look anoth flight,negative
go take hournot okay usair okay ruin everyth,negative
delay,negative
min hung alway aw call reserv,negative
userment guess take chanc keep courtesi free seem cabin alway full,negative
hour late flightr lost conect,negative
hold reserv line embarrass aa platinum member,negative
love chang loung chees veggi oliv addit cracker snack mix,positive
thank anoth method also would nice appear design flaw,positive
ye everi one everi flight like need velcro someth,negative
pleas secur footrest shelf busi class a330 airplan url,negative
forget fuel realiz cargo add plane one way tri mask delay,negative
gate team polit plane habitu late flight mani case passeng wait flight crew,negative
fuk u us airway yo shitti chicken salad sandwich overpr u fuke make wait hr layov fuk u,negative
uncertainti know u run account u creat polici undu penalti job reqe flexibl,negative
let us go runway mechan problem wewantcomp,negative
wtf go dc bo twice go back back gate leav runway total bs,negative
move tarmac delay unknown reason keep post,negative
keep miss updat connect need make jax friend wed strandedattheairport,negative
guy lose luggag suppos flight highli disappoint med cloth,negative
userment poor excus toward front plane sandwich pay,negative
patient annoy cannot book travel onlin make peopl wait phone,negative
still yuma wait go look like might miss montereyregionalairport need option pleas,negative
userment thank feedback thx help watch flt lve wopen seat wait nxt flt,negative
lol,positive
still wait respons,negative
call use credit fm prev cxl tix cannot rebook onlinerep call quot higher websit,negative
basic stuck pay hidden fee bump inferior flight jetblu come usairway merger,negative
oh ironi dog spot bark wait area right front pleas send cocktail coupon stat,negative
thank gate agent state colleg pa abl get earlier flight figur earlier connect,positive
think weird mileag,positive
kid anxiou husband cannot sit current setup warn seat chang,negative
guy switch inform chath,negative
worst airlin ever left without luggag day submit expens offer refund badservic,negative
app bad feel bad,negative
still irrit well plan book return mess warn,negative
probabl lose famili world travel custom due broken process userment hope fix,negative
ye thank never seen anyth like come yuma time big disappoint still wait,negative
hear lot instead feedback get back home,negative
ass backward process use credit flight even tri get hold custom relat imposs,negative
userment destroy live eastern userment live littl event profit,negative
hour cross countri morn flight food badservic,negative
understood sympathet get back pay especi switch flight,negative
bought ticket month ago seat togeth chang flight kid seat scatter plane,negative
person check peopl plane board minut tell peopl userment exec bene honor,negative
cancel flightl due mainten plane hour get shit togeth lot peopl unhappi,negative
year everi time us air someth happen sat wait reschedul flight hour say,negative
switch american airlin flight choic charg bag thought yall merg,negative
flight cost happen fli userment problem come us time,negative
got philli monday got final destin south carolina wednesday accept,negative
hour still one yuma counter,negative
peopl line stupid heck,negative
peopl line wait minut custom servic repres,negative
userment feel sorri aa,negative
one yuma ticket counter minut peopl line terribl servic,negative
amaz day delay hr bc frozen h2o plane sit gate plane min still wait flight1797,negative
stuck philadelphia airport hour due mainten dread flight back home disgust,negative
sincer regret dividend mile good thing come end,negative
thank,positive
thank tell flight time plane broken inferior airlin,negative
call resolv dividend mile issu week avail pleas advis asap,negative
final answer rude help,negative
success made flight pleas thank crew great time recoveri,positive
far good week sav clt board departur time first time week perhap time departur,positive
hold min count caus charg credit card bag provid receipt said error aw,negative
still sit feel badli handl,negative
lilli sju check fabul,positive
hold two hour got hung oh god,negative
phone hold min tri speak agent cannot chang reserv onlin sigh badcustomerexperi,negative
thank,positive
music hold hour tri get aadvantag membership merg someon pleas call asap,negative
sorri meant flight suppos depart say issu,negative
move seat bought month ago happen far often,negative
could chang name userment would awesom also plane smell like onion ring,negative
tbt everi day,positive
issu flight jax delay tonight,negative
got rebook sent a9 wrong gate travel back b13 correct flight,negative
dl send ethan new pant white reviv laundri tab great guy good crew err singl,positive
updat flight philli la sit gate close hour,negative
price honor ive wait hour hold make sure still get price origin start,negative
thank refund bag fee look forward return today hope,positive
happen phl lax hr delay poor commun,negative
stuck phx overnight servic get wors fli southwest,negative
left us stay flight got bag suck run babi bag,negative
pass frustrat hour ago ask get first plane sat hour,negative
thank,positive
anoth bad experi today frozen pipe miss connect,negative
cours yeah travel gotten harder ask passeng switch fact attitud,negative
never imagin would hard spend money us air stubbornli hope someon come back phone,negative
found great price thru us air honeymoon websit wont work hold hour told min,negative
flight phf clt termin cannot get plane yet need get iah flight,negative
hold two seat flight phx la delay flight go arriv ontim,negative
userment chairman class flight today system cancel flightl ticket kick,negative
hold minut get receipt know guy busi think time higher staff,negative
thank hour layov la ice cake least staff courteou help unreal,positive
yeah expect hour,negative
wish fli userment userment cancel flightl flight tomorrow never notifi us flyu ripoff,negative
mphx im still plane wait wait,negative
tri merg freq flyer acct keep get error messag machin call provid help,negative
hold captain late flight bag fit,negative
,negative
thank slow inbound plane need worri eyw late flight great holz ahead cheer,positive
turn seat cushion clean area pleas explain issu,negative
book seat end last row label occupi play music chair min unaccept,negative
phone support rebook orig flt late flight made,negative
kudo phone support charlott gate staff,positive
let say directli correl flightd chanc replac case know would cost airlin less,negative
afternoon confer la vega would rather plan ahead run thru airport attempt,negative
userment tri stuck tarmac wait gate emoneg may miss connect,negative
thought move lot busi first impress count glad mile cash,negative
flight delayedconnect help flight help via email,negative
hey let know worst fuck servic ever use thank noth,negative
tri call cust serv system hung twice system issu pleas advis,negative
wife tri check flight tonight rsw websit allow say must go airport,negative
lol thank switch american url,negative
preciat cant get plane speak w agent wont come plane knoxvil,negative
call reserv cannot chang abl put note re problem tsa,negative
delay ty like gonna miss connect clt cun gotta get today help,negative
plz plz plz hold eyw phl soo late flight gonna miss connect userment gth239,negative
hate,negative
passeng maiden name end last name onlin flight book problem ye understand non transfer,negative
understood us airway get tsa problem,negative
paid seat expect abl use full seat,negative
passeng larg put armrest use part seat recours nothappi,negative
told code upgrad clearli purchas seat mile refus downgrad ripoff,negative
gate agent said book full sorri ticket class seat call custom servic land,negative
empti class chairman cannot move due silli award travel rule trump common sens custom servic fail,negative
airlin open sooner confid booster,negative
check last night airport supervisor w board pass board today seat chang happen,negative
new problem wrong last name reserv airway fix new cannot get tsa,negative
cardhold fli us airway advantag card frustrat,negative
worst trip littl custom servic,negative
test patienc even shall say morn wait hour gate find gate agent,negative
fli manchest intern philadelphia get email delay inform connect flight,negative
thank you3860 cincyjust landedy add frequent flyer mile account long incred frustrat day,negative
credit card statement receiv anyth way look,negative
wait hold long wait hold forev never receiv confirm place help,negative
deal w userment solv prob team creat manch nh staff clearli cteam btw notevenjv,negative
,positive
unfortun doubt consist subpar servic improv userment merger usairway,negative
thank fill claim hope bag tomorrow,positive
cancel flight flight love anoth flight forgot bag,negative
done,positive
told ticket expir never recvd notic expir sucksi paid mile tckt,negative
captain flight phxphl tonight hilari greet pointi end airplan haha thank,positive
worst custom servic still provid answer even drove back clt airport rude unaccept fail,negative
run patienc sit bu without air front plane commun anyone40min,negative
delay cancel flightlat doubl layov hour late flightr could least get extra dividend mile,negative
take origin flight suppos arriv last night today get til,negative
sit minut runway dca gate full earli land late flight flight,negative
flight4592 let us plane pleas go gate absurd,negative
userment trip row miss luggag like last time pay baggag transport,negative
lost luggag yay,negative
realli frustrat endlessli wait phl ground crew taxi us night take long,negative
thank call redirect flight smoothoper,negative
bad custom servic experi help,negative
tri reach dividend mile extend ticket last day call get messag call back,negative
airlin misplac airlin attend reagan airport sinc cinci delay tri find,negative
flight final arriv charlott book luggag thru lga room flight mess,negative
hold hour still know bag refund flight weather,negative
,negative
wife flight chang due weather cant checkin return flight fail possibl usair cancel flightl,negative
thank fix hour delay,positive
yup minut limit wait hold thank noth,negative
patienc accept url,negative
flight flight attend flight freaki coincid plu side great,positive
land safe everyth work,positive
explain hold hour dumb use differ airlin wth,negative
use even flight dcadsm earli return middl work day inconveni,negative
delay max,negative
sunday cannot wait see,positive
well nofun nocustomerservic onhold tri make reserv nothappi url,negative
take longer get gate flight take minut fli time minut runway far,negative
attempt ckin flight day site unabl retriev detail call twice disconnect,negative
email week ago still noth,negative
would will pay anyth chang flight userment help,negative
yeah guy told call websit book book websit unaccept,negative
still wait captain report call time get ground crew still sit runway evenl flightr,negative
real mvp hold flight connect philli tampa,negative
final rectifi flight situat thank,positive
time today phl nice work thereisafirstforeveryth,positive
like lost busi terribl experi mani time stuck tarmac last min cancel flightl flight done,negative
day cannot find bag anywher bc say never scan technic never left lax,negative
ground crew dca alreadi late flight arriv evenl flightr,negative
told tough break unaccept cannot even tell bag,negative
ice cream front solid,positive
shout pilot fc attendanteliz us super strong crosswind land eliz super job throughout,positive
tell correct tag luggag luggag appar la charlott ok,negative
softwar broken call custom support fix like said earlier yell develop,negative
doubl book spoke cs got plan fix still amateur mistak never happen,negative
userment hey guy due horribl custom servic issu way get check bag credit,negative
delay day weather top got yell late flight notifi time chang welldon,negative
great experi first time fli us airway go forward probabl take busi elsewher,negative
loos lot busi use barclay cant believ cant appli card live iowa,negative
accommod dsm flight tonight delay myrtl beach flight dsm back tonight,negative
far gotten six differ answer,negative
oh certainli two pend transact bank account realli happi charg doubl,negative
go hear notfriendli pleas wait repeat hold transfer idk,negative
captain turn seat belt sign peopl get walk around good,negative
sorri well hr without bag cannot get straight answer call today,negative
ya need work onlin checkout system two bank transact one ticket bush leagu yell dev,negative
wish way there problem wdeicingthre hour delay far sill sure take,negative
could ran usexpresspsa worth damn would stuck horribl clt,negative
run piec shit airlin thank ruin aa,negative
userment appreci shoutout roberto dm confirm code forward ur kind confirm code,negative
final back board door close reopen need fuel think someon wd thought earlier,negative
secondari screen piec plane miss anyth want tell us,negative
sit tarmac pit min announc sit,negative
appreci actual monitor twitter pleas pass along feedback tri call time day,negative
cant help frustrat hour call u end disconnect answer especi div pref member,negative
think ever us airway flight went smoothli,negative
pleas improv phone system go multipl prompt menu told call back late flightr major fail,negative
servic leav lot desir flight earli short staf mean wait tarmac thank,negative
late flightr flight charleston leav flight schedul earlier wrong,negative
delay cha miss connect charlott lga good,negative
ad seven hour day far want take odd bag carousel kc notcool,negative
userment miss uncl funer hope find anoth flight consider,negative
last flight cancel flightl disappoint,negative
lost faith custom,negative
time one abl help,negative
marsha myrtl beach greatest deserv respect prais thankyouforeveryth,positive
serious attend go awol min flight delay lite match either url,negative
join silver prefer heard custom servic great piti misguid,negative
bad practic disappoint airlin prepar honestli last time fli guy,negative
well worthless regular servic bunch noth idiot suck,negative
chang well late flightr find flight schedul readi,negative
cancel flightlat delay caus miss connect flight anoth night home thank pathet,negative
understand issu creat new flight without personnel chang plan accommod,negative
thank need locat luggag,negative
depart yet let get high hope everyth schedul far,positive
thank show interest greenvil sc,negative
app suck ball compar userment,negative
usairway flight late flight get charlott miss connector phoenix thank last time ever fli usair,negative
admir club clt rude ignor front desk staff userment fallen far thank doug parker,negative
clt jfk nasti plane dirti seat floor rude flight attend hope aa get clean disgust vile,negative
paid ticket userment still say pend normal want money account,negative
ok thank told ground delay due snow,positive
made cancel flight car reserv came money reschedul time without crew,negative
flight cancel flightl yesterday move today stop dc flight delay due lack crew us4485,negative
dont think alreadi said one respond auto respons wait auto respons,negative
userment first class head userment url,positive
start tri reach real person hour ago still luck,negative
us2118 wife boston say snow right,negative
tri call custom servic line kept que min pleas hold care,negative
see lie auto respond insult email suck,negative
pple great job w mad howev system need help appreci hard work push b better,positive
thank give away seat anoth fine job url,positive
userment stuck plane due snow boston actual snow boston usair flight us2218,negative
wait desk hold count photo desk agent phone flatter,negative
thank,positive
cancel flight flight time past day experi worst never,negative
thank betti work gate ilm love gate agent clt help get home phx tonight instead tomorrow,positive
realiz weather day day flight keep get cancel flight pleas priorit ur passeng help,negative
help get respons usairwayssuck,negative
userment team back home luggag wet partli damag happi blizzard,negative
surprisingli quick respons time thank,positive
stop cancel flight flight provid real help custom strandedinnashvil,negative
strike lost bag two theworst,negative
cancel flight trip la bc weather userment easi us air make pay use credit never,negative
point baggag claim ticket scan track,negative
access dividend mile week autom phone keep tell call back late flightr frustrat livepersonpleas,negative
cannot even track bag see like disappear,negative
cannot get ahold anyon speak miss mile month sinc travel submit twice onlin,negative
sit plane minut say anoth minut someth paper work suck,negative
