text,airline_sentiment
let delay jfk inbound flight syracus realli ishouldhavedriven,negative
year old cannot sit alon flight absurd guy dick jetblu url,negative
told guy help us sit next year old flight jetblu url,negative
thank send updat flight delay hour unbeliev,negative
hour delay hour increment realli mosaic still pay use loung wast sunday,negative
done yet someth onlin thx,negative
userment wifi flight cannot tweet oscar parti pic bluecarpet emoneg,negative
thank repli would appreci commun check delay jetblu use goto,negative
also promis chang wife name account also done wtf,negative
guy realli suck spent minut phone link credit account still,negative
btw robin hay speak next month userment aviat summit ought give shout twitter team rock,positive
oh thank respond,positive
come thought tampa,negative
good perspect safeti concern express point arriv airport communicationiskey,negative
exactli flight delay bdl dca cannot seem get answer,negative
thank ticket stand flight hope make finger cross,positive
flight bo rsw tomorrow need wife old sit togeth option check,negative
left peopl hot plane ventil hour half bu jfk,negative
point delay take differ flight destin,negative
thank guy best,positive
get money peopl public apolog presid jet blue,negative
book flight jetblu separ old mother bit stupid checkin headach,negative
fit,negative
love alway,positive
never got wife destin expect goodwil credit make everyth hunkydori blew,negative
everi time look flight statu minut ad delay point troubl,negative
hey awesom peep flight boston delay,negative
great experi flight sfo jfk seat servic food everyth top qualiti back soon,positive
flight pick twice week time delay,negative
delay boston today sister tri go home broinlaw tri come rdu crazi,negative
boston still sit,negative
dont enough money park garag fault im pay,negative
thank replyingi feel littl better see goe,positive
wait hr bag flight hr,negative
bother contact alreadi check flight,negative
backlog hour two unaccept,negative
agent told us tsa crew get bag,negative
guy rock,positive
email twitter handl follow gmail,positive
awesom bestairlineev,positive
baggag crew updat staff incompet answer hour,negative
blame userment flight luggag debacl luggageg,negative
yoga tv servic seem though emoneg look forward much,negative
fail answer pleas justifi otherwis,negative
come alreadi delay hr flight wait pilot come boston reassign endless trip,negative
got alert immedi start look rebook minut reflight book problem catch flight srq,negative
fli jet blue,positive
start includ pto getaway packag,positive
thank use extra time shop somebodi say duti free,positive
flight flight book problem experi pretti great,positive
still wait board see give us exit row,negative
thank make trip home mintyfresh next brandmanc flight take selfi love travel busi,positive
find tell us flown jet blue sinc first month experi,negative
flight delay show airport appropri amount time delay go time,negative
honestli would like get go journey,negative
case alert arriv late flight fourhour delay buy,negative
flight tv flight back seat togeth b6 mayb fault still fun,negative
believ team told us,negative
also food avail even purchas quit shock sinc hour intern flight,negative
jfk one info answer board plane team awkward spot everyon cranki,negative
flight still wait bag us check hour ago peopl miss connect pleas help,negative
someth think deal peopl wrong excus figur expect unexpect,negative
understand wish would announc delay hour earlier vs sit hr mco,negative
give delay hour mco jfk everi time,negative
userment well captur brittani love cloud emopo enjoy thank,positive
wife dog would even let plane daughter newburgh live close wrong,negative
accord ground staff even taken plane yet,negative
userment thank make effort credit credit due flight delay hour instead hour fwiw loweredexpect,negative
time passeng sit hot plane air commun hour wrong,negative
flight delay jfk hour hour hour back hour explan apolog,negative
thank good sunday,positive
flight hour weather delay minut delay get bag tire passeng,negative
tarmac yest b4 cancel flight userment hr delay send txtemail jfk close save trip sit userment,negative
fli buf bo miss captain realli delay til happi,negative
would nice app would actual inform flight delay,negative
know want pass along good t5 experi esp someon fli time month,negative
plane stuck newburgh start weather relat flightd well passeng plane hr,negative
thank home msi tsa precheck agent direct peopl photo scan beyond rude one grab push children,negative
hold music suck,negative
jfk t5 north check bag drop ladi check someon entir time anoth check in,negative
excus though gate chang though,negative
someon bother inform us airport close would help,negative
get home flight buf bo miss captain realli,negative
nope flight leav almost cannot believ paid money,negative
thank final gate,positive
flight orlando unabl serv hot bevi made movi alcohol complimentari work,positive
userment updat get idea get updat way go hopeless,negative
userment cover cost car servic wait time,negative
land usual great flight wiyh great crew hello sunni west palm beach jetbluerock,positive
ridicul hour come wait deplan newborn board,negative
wait hpn plane hour sinc land bc gate pleas get us plane,negative
late flight sever passeng inebri leagu big alcohol shame,negative
thank make vacat worth current wait runway anoth hour deplan,negative
let san fran media rate deal look like last time fli anywher,negative
amaz thank,positive
empti help desk,negative
closur peopl need inform passeng send gate gate w info board updat departur,negative
accord jfk plenti plane land problem,negative
thank third gate chang url,negative
userment beauti shot thank share use flyfi post emopo welcom flight quicki,positive
flight jfk cartagena airport bar sing opposit prais make pact never fli u,negative
help problem easili nice guy rock,positive
happen plane meant leav wait buffalo seem organiz error weather,negative
award win servic,negative
realli accept inform plane start charter bu take passeng jfk,negative
much longer jfk openg diabet need sugar plane noth,negative
flight sent back gate even though app say leav anyon clue sunni jfk,negative
u guy kid help anywher hour delay still answer bad cust servic idlovetoask url,negative
sent plane anyon jetblu clue,negative
unfortun startl rush get name provid descript expand email thank,negative
custom servic agent bonni amaz phone deserv promot,positive
rude rep tri book famili vacat use trvl credit phone w new rep help,negative
bo everyth current thank follow,positive
sunni gorgeou ny actual real reason,negative
thank info alreadi board look forward futur upgrad jetblu url,positive
thing happen ok wish beach airport,positive
hour sent plane hangar flight jfk absolut ridicul,negative
love jetblu flyfi abl charg devic domest a320 flight thank url,positive
still sit plane newburg get ridicul way treat loyal custom,negative
touchdown jfk well done pilot jetblu flight jetbluerock,positive
delay system,negative
think any1 rli know goin suppos leav,negative
graciou userment tell go buy water snack flight delay hour,negative
appli new tag left bag ground rather load convey belt walk back yard,negative
get flight air,negative
weather relat flightd nice blame weather airport prepar investig time,negative
tux would date umosaicmecrazi url,positive
thank person custom servic cannedtweet autorespons,positive
agent demand remov old luggag tag everi airport jb agent polit handl,negative
also mosaic custom fli jet blue alot,negative
much delay fact flight still come time app give us honest estim,negative
wave someon behind step forward although explain happen indic need make flight,negative
flight depart even board,negative
knew reason u favorit airlin read answer twitter globe morn great job,positive
here part bag drop insert jetblu cc print pass agent stand front refus print pass,negative
wear truebluecolor,positive
heard weather fine morn flight circl timesomeon forgot clean runway,negative
min past schedul time w departur sight flight longer qualifi time updateyourwebsit,negative
entir system go realli,negative
appreci head flight delay bc crew stuck boston communicationfail dobetterjetblu,negative
serious system,negative
yup know fault ideal sittin hour alway staff great,positive
horribl experi check agent fort myer document send detail boston,negative
flt1533 carta goin told plane come hangar gate chang one know wat plane get,negative
got thank quick repli,positive
someth tell crew job,negative
app need updat say flight time well past board time delay url,negative
great experi work glenn cole buffaloniagara airport top notch employe,positive
well last updat right direct least keep finger cross,positive
thx social media person,positive
airportwid delay bo get unlucki,negative
jfk still close tryna get ft lauderdal flight want get home nyc,negative
woulda nice let us know post board still show flight time,negative
hmm say im follow got deic still hane around runway clear,negative
alway mosaicmecrazi sunris bestairlin nofilterneed love url,positive
flt phx delay hr circl hr divert upstat ny sit hr commun horribl,negative
miracul fix plane kudo shoe ever,positive
onlin resourc say time clearli inform age,negative
crew gate,negative
yall realli better american airlin though,positive
tell updat board,negative
say come brandloveaffair w userment ur soulandinspir url umosaicmecrazi,positive
issu jfk pilot explain jfk reopen get schedul back cannot divert lga closer aci,negative
want talk wall,negative
great servic pbi hpn thank,positive
poor flight manag reason schedul pm flight takr,negative
done thank,positive
note time taken flight still list time onboard url,negative
flight list time plane yet url,negative
ok got far atlant citi due jfk close get us hpn lga pleas,negative
need eta pleas,negative
fli delay ice jfk switch late flightr flight free,negative
nasti boston famili drive min pick eri think flight cancel flight,negative
userment best way kill nine hour airport flight full airlin put standbi strand,negative
ye said runway readi wait port author remov snow sight,negative
travel busi twice week userment fiasco fli blue often thank,negative
see money poor servic stuck virgin america think tri jetblu,negative
suck custom servic worst what point loyalti scheme honor badairlin,negative
fll mde great flight great custom servic thank mth wait userment speak human custom servic,positive
updat flight leav tf green delay,negative
well said cancel flight pa system guess tri get plane boston confirm,negative
get page cancel flight min ago userment userment help flight userment mco,negative
flight cancel flight due lavatori problem cannot confirm gonna get flight boston logan int,negative
okay thank check,positive
woman stole seat plane one sit elsewher standard protocol,negative
userment good morn sylvi great flight thank jetblu userment userment jetbluerock,positive
came thank followup best,positive
thank see soon,positive
yep still wait bag jfk holdup look like flight got time,negative
thank get us nyc jfk realli safe emopo srsli long take get check bag etern,positive
full six us leav flight wait whole day get flight kid miss school,negative
board order someon board servic anim member parti allerg flight,negative
ridicul got home suppos land hour ago bc hella tire,negative
lost loyal custom use time year,negative
thank respons next flight flight,positive
highlight travel hour delay deic twice sit bumper bumper traffic taxi final get home,negative
great flight brand new jet great seat beauti plane big fan airlin,positive
voucher cannot believ took risk plane terribl filthi scream babi face,negative
thank know weather boston great everyon tire,positive
spoken jb team explain situat didnt seem matter anyon guess expect,negative
shock misbehavior cheap comment jet airway staff passeng delhi airport friday board dubai disgust,negative
servic remot control flight watch equal movi three time remot stuck,negative
userment oh wow complain two hour run way shuck jetblu good servic better,negative
curiou know compens passeng miss engag due two hour wait tarmat get gate,negative
thank thank final set jetblu app yay,positive
everytim come back boston minimum min wait bag earlier almost hour boston jetblu,negative
thank take back home today despit pandora best effort cancel flight flight jetblu backhom noplacelikehom,positive
employe logan told final got one meet daughter first solo flight rude rep,negative
custom servic brutal,negative
userment airlin sound outstand twitter feed clearli extrem use keep great work,positive
amaz short delay gave credit liter pretti much fault miss flight,positive
flight attend hesit give babi size cooki,negative
u let make fun size cooki stuckonaplan so babyfood,negative
thank stand line,positive
thank ye order rum coke get hotel voucher floor chair cushi,negative
thank,positive
pass along wife daughter daughter friend elderli motherinlaw spent sever hour wait,negative
miss goal userment inept male stewardess land alreadi havent taken yet,negative
horribl job jfk need rethink put rout togeth unprofession,negative
let know statu flight pbijfk delay board problem hatch,negative
thank respons crew patient us also frustrat would bad airport close,negative
interupt staduim seri userment dont need see stupid commerci emerg info,negative
well awar insuffici info option,negative
sat plane hour dull insan ijustwanttobeinboston thanksdc,negative
get honest updat departur flite plane infant children,negative
u suckw sit ur neglig,negative
still wait bag flight land hour ago,negative
complet wast entir day pathet,negative
flight us stuck plane nearli hr set take flight control deni us worst servic,negative
userment best,positive
thank bring son home,positive
got hot ladi fli air life loyal,positive
noth prais help ladi make flight ch tonight impress,positive
still wait callback lack follow concern smh,negative
heard anyon week nonstop flight baggag loststolen custom servic,negative
got luggag wait min went home right famili ada friendli wait long w chair,negative
thank much cannot wait fli guy,positive
flight jfk hr delay could get weather relat flightd consid come,negative
ok thank,positive
thank speedi flight time recoveri,positive
thank take care drink sinc inflight entertain work goodcustomerservic,positive
would say delay like thank much,positive
woman who lead work gate c26,positive
follow abl dm thank,positive
figur flight hard believ oil low kill u make even part hotel cannot comp would,negative
want give warm thank crew logan airport still get dc area cancel flightlat morn,positive
anoth awesom telephon experi userment thank cori,positive
saw one useless tsa agent inspect shoe,negative
disappoint miss connect roc slc reimburs even tho friend pilot said due atc,negative
thank,positive
went beyond help,positive
find unfortun emoneg help took info incas get found,negative
employe charl cave gate msi went beyond help tri help find glass thought u know,positive
best cannot wait use travel bank fun trip,positive
touch neworlean annual userment nation distributor confer livethelegend,positive
plane hope longer merci playlist thank,positive
crew one help,negative
custom servic pleas call,negative
hotel also jetblu lost daughter luggag lose luggag plane never actual left,negative
thank prompt respons know put safeti first unfortun hit freez rainsleet ride home,positive
ok super help thank reach question,positive
thank instant repli still first bag free import,positive
lipstick pig still pig ur new baggag claim sju disast chair min wait baggag fail,negative
half hour wait unreal final first bag come sju need work,negative
long take bag get baggag belttoolong wait,negative
delay delay palm beach need head westchest give info,negative
hey jetblu strand entir plane suppos go jfk get restless need better commun,negative
hey jetblu cancel flightl flight st maarten jfk strand famili baggag area lost daughter luggag,negative
excit time ahead,positive
websit serious horribl call center almost make tempt fli someon els sodon,negative
allow flight chang ny area airport tonight everyon say travel treacher,negative
count flight get dc,positive
cool gate turn flight fll jax delay yet app say time good start,negative
supervisor avail could anyth,negative
learn custom servic sxm work airport jetblu need supervisor anyth,negative
tri fli bo jfk flight delay travel kid book hotel get tonight,negative
tri help terribl custom servic airport least,negative
tell point u realiz u cannot fli dca tonight u cancel flightl u cancel flight,negative
make bad situat wors cancel flight flight make us stay overnight sxm provid voucher stay differ hotel,negative
alreadi cancel flightl one b4 us dca,negative
physic imposs make airport flight schedul leav less hour,negative
point u cancel flight flight dca airlin alreadi cancel flightl,negative
great flight url,positive
cannot beat jetblu space matter url,positive
great thank,positive
would like send email lost found jetblu jfk spoke morn cannot drive today,negative
want room food allow agent refus give us voucher use room book,negative
send servic agent strand passeng,negative
hope flight seattl boston wifi first one entertain lizaapprov,negative
good hear thx respons,positive
custom feel like stick airlin jet blue travel work past year never seen,negative
cool thx coupl pgashow flight til mosaic cannot wait easier chang flight weather bad userment,positive
thank much help us u r amaz,positive
kudo done head warmer weather,positive
price year know buck seat crimin understand price fli jetblu pricewis,negative
awkward,negative
guy need live chat,negative
obvious link noth tri book,negative
awesom thank,positive
quick person travel w mosaic get green tag make sens end waitin son bag anyway,negative
got wish would commun w us,negative
continu record never flight leav time add much time famili cost jetblu,negative
guess redo flight book problem ugh,negative
suck oh well,negative
stand cell announc info thismosaicnothappi,negative
someon info smh one bag came noth,negative
there noth appar connect true,negative
u see hold flt bag one bag came noth els minut,negative
would credit right account instead separ sign seem pretti ridicul,negative
thank updat url,positive
userment userment cours emopo bestdress bluecarpet,positive
seem never receiv id password,negative
ye last month boston got first big snow storm flight cancel flightl,negative
travel bank credit go cannot call right,negative
offer complimentari drink switch seat stewardess ask age said giggl goodgen ilookyoung,positive
thank still book trip lb slc see grand kid frustrat tri app web etc still love u guy,positive
thank excit fli first time,positive
thank u userment cours safeti alway make sure handl care love emopo,positive
kudo jetblu social media team jump help last snow storm web site thank,positive
love airlin hate websit tri book ticket w mile wout absolut joke need lot work,negative
thank much condol quick respons much appreci,positive
thank alicia exceptionalservic,positive
ye de baggag claim sad baggag treat us pleas need baggag,negative
mom baggag lost fli fort today colombian employe treat us badli need help pleas,negative
chang made song pass print conf mine print express disappt w jetblu,negative
cancel flight,negative
unhappi custom wait min hold rude uncar rep frozen acct cannot print bdng pass,negative
first place realli need extra stress alreadi terribl time oh way made flight,negative
miss flight book flight extrem last minut due famili death there excus attitud,negative
seriou attitud fault run tad behind even knew name flight info assur,negative
fli wu much howev kiosk broken syr woman work ticket counter,negative
thank chat nice fella gave lowdown,positive
mission accomplish gave userment hug url,positive
ok thank quick respons jetblu still best comp,positive
im session present one belov travel userment see love much url,positive
fli denver march flight itenari keep get chang heck book trip month ago,negative
hold foreverr,negative
happi custom wait patient mention six month marathon train need tmrw,negative
wait flight fl marathon tmrw chariti u bump us late flightr flight cancel flightl fix,negative
oh definit kind fli jetblu,positive
want fli storm right give us choic kid want chanc nixchangefe,negative
thank get orlando earli happi,positive
fail snow come dc area tri get earlier flight refus flight hour delay greedi foolish,negative
got thank,positive
userment thank includ us tour pack winter ye werenotincalianymor,negative
even though flight much need hot beverag us nyer land super smooth happytweet,positive
websit cannot print board pass,negative
thank get boston earli userment break barrier clean energi futur,positive
thank,positive
thank complimentari upgrad first best,positive
ah staff perfect morn jfk sleep,positive
userment wow awesom video guy url great work blueman corevalu passion aerojobmarket avgeek,positive
userment wow amaz video url great world guy blueman corevalu passion aerojobmarket,positive
today famili get experi mosaic statu w lifeisgood,positive
word thank,positive
ideal okay better late flight never,negative
yeah done defin incident much spend gear trip wast,negative
guy lost bag ski gear flew nyc ski buy new stuff tomorrow,negative
smf jfk,positive
hold min place hold hung time day look group rate bossju peopl,negative
custom servic terribl neveragain flywhonotblu,negative
delay ridicul,negative
flight attend suck alway rude emoneg bad experi jetblu tonight,negative
say person delay hour sit runway wail babi,negative
flight delay still sit runway minut far air travel best,negative
may cri,negative
site let book ticket nov jfk kin,negative
late flight lost almost hour bay area weekend mention two hour unnecessari vacat time work flt348,negative
cours,positive
thank,positive
thank,positive
ye get exact data download fine upload bandwidth ping issu ping especi,negative
userment love jetblu speedi twitter custom servic,positive
thank,positive
thank much effort,positive
thank let us know hope delay,positive
appreci respons worst part lose non refund hotel orlando crew blame wind hope delay,negative
aw flight jfk honeymoon delay lost money hotel delayforwhat,negative
flight freak nightmar tonight sittingonthetarmac delay,negative
appreci speedi respons longer delay inconveni put custom pleas nix chang fee,negative
thank,positive
what go flight delay beyond shouldnt thre flight switch point,negative
thank info figur case hope new hashtag chang emopo abcletjetbluestreamfe,positive
broken tv seat flight today plan catch userment game noo,negative
bein call jetblu respond leav number call back think jetblu loos custom,negative
flt lax fll ppl sleep id rather disturb flight tri dl movi go url,negative
made costa rica back userment miss alreadi pura vida,negative
love guy know paid prem wifi toplay userment go ping terribl url,negative
save day emopo userment lost costum jetblu makingthingseasi feelbett,positive
thank make miss import dinner tonight hr delay min tarmac worst,negative
ye terra blue chip favorit,positive
dm would confirm code thank help mommi daddi kid appreci,positive
enough hand count number time someth like delay flight guy disappoint,negative
call number left messag pass along messag team,negative
cool userment userment anticip complet instal a320 year url,positive
love guy soo much ridicul appreci servic,positive
option luggag assist ground hpn flight delay hour sleep kid land,negative
ask slc checkinbag drop found dark blueblackish fit bit flex would lost around mt,negative
offici favorit thank wonder servic jfk,positive
serious go url,negative
news flight pbiboston delay wait arriv airport base report hour delay,negative
airway corpor nasdaqjblu reach new high rang streetwis report url,positive
thank,positive
userment sorri board chao underway pleas queri post scrum,negative
board realli impress learnt valuabl lesson,negative
userment ye file claim issu credit courtesi whole thing seem except uncourt,negative
userment ye board good luck push wheel realiti dare,negative
tri burger good expens lead believ food usa cheap butnot,negative
tri tire get grumpi,negative
flight1407 long day arriv london morn,negative
deal plane ground instead divert plane ad hr flight,negative
look like inflat car seat got left plane guess back sometim savethoseseat,negative
thank,positive
jan summer url,negative
look forward final take,positive
flight alreadi delay,negative
must alway delay late flight night orlando flight,negative
second incid lost baggag sent dm thought,negative
mayb announc delay sit plane runway hour take,negative
pleas come indianapoli,positive
flight bo tampa takeoff min late flight,negative
userment ah grasshopp twitterz kung fu good hire geek url,negative
discontinu nonstop servic sjc bo cannot find anywher,negative
noo previous direct flight divert la arriv almost hr late flightr,negative
well let see could pay negroni bitcoin userment,negative
okay thank hope fli guy soon,positive
love natur beefjerki,positive
thank repli flight,positive
must send note good word,positive
cannot seem dm guy jdhadp,negative
love capt joe flight bo sfo fun,positive
two delay littl proactiv commun goe long way howhardcanthatreallyb,negative
worst view athlet watch team front seat chase van nogearnotrain,negative
fabul pleas,positive
u real mvp url,positive
worri time flew termin take thank,positive
messag thank,positive
thank,positive
